group_id,title,published_at,url,keywords
1,McLarens struggle as Leclerc fastest in practice,2025-11-21T01:40:50Z,https://www.bbc.com/sport/formula1/articles/c98n8zeygdko,"MCLARENS, STRUGGLE, LECLERC, FASTEST"
2,Navigating faith on the road,2025-11-21T01:30:00Z,https://www.bbc.co.uk/programmes/p0mhx73d,"NAVIGATING FAITH ON THE ROAD KEYWORDS: 

FINDING, CHALLENGES, GROWTH, JOURNEY"
3,Eubank wants win for home crowd on world quest,2025-11-21T06:05:25Z,https://www.bbc.com/news/articles/c3vnvyk5dzeo?xtor=AL-72-%5Bpartner%5D-%5Byahoo.north.america%5D-%5Bheadline%5D-%5Bnews%5D-%5Bbizdev%5D-%5Bisapi%5D,"EUBANK, WIN, HOME, CROWD"
4,Biggest prostate cancer screening trial in decades begins in UK,2025-11-21T01:45:04Z,https://www.bbc.com/news/articles/c2kpk80epp9o,"TRIAL, BEGINS, UK, DECADES"
