group_id,title,published_at,url,keywords
1,Seahawks steamroll 49ers to advance to NFC championship game,2026-01-18T04:17:57Z,https://www.usatoday.com/story/sports/nfl/2026/01/17/seahawks-vs-49ers-seattle-dominates-san-francisco-nfl-playoffs/88239247007/,"SEAHAWKS, STEAMROLL, NFC, CHAMPIONSHIP"
2,Cowboys legend on coaching trajectory that could lead back to Dallas,2026-01-18T02:00:32Z,https://cowboyswire.usatoday.com/story/sports/nfl/cowboys/2026/01/17/cowboys-jason-witten-potential-future-coach-sooners/88202706007/,"COWBOYS, LEGEND, COACHING, TRAJECTORY"
3,MSU football defensive back transfers to MAC school,2026-01-18T00:00:22Z,https://spartanswire.usatoday.com/story/sports/college/spartans/football/2026/01/17/michigan-state-football-armorion-smith-toledo/88236580007/,"MSU, FOOTBALL, DEFENSIVE, MAC"
4,Winners and losers from divisional round in NFL playoffs,2026-01-18T01:34:53Z,https://www.usatoday.com/story/sports/nfl/columnist/nate-davis/2026/01/17/nfl-playoff-winners-losers-divisional-bills-broncos-seahawks-49ers/88237453007/,"WINNERS: CHIEFS, BUCS, BILLS, PACKERS
LOSERS: RAMS, RAVENS, BROWNS, SAINTS"
