group_id,title,published_at,url,keywords
1,Yankees must make opponents pay for walking Aaron Judge,2024-08-05T00:29:54Z,https://nypost.com/2024/08/04/sports/yankees-must-make-opponents-regret-walking-aaron-judge/,"YANKEES, OPPONENTS, WALKING, AARON
KEYWORD: YANKEES, OPPONENTS, WALKING, AARON"
2,US expected to propose barring Chinese software in autonomous vehicles,2024-08-05T01:41:27Z,https://nypost.com/2024/08/04/us-news/us-expected-to-propose-barring-chinese-software-in-autonomous-vehicles/,"US, PROPOSE, BARRING, AUTONOMOUS"
3,Mali cuts diplomatic ties with Ukraine over Wagner ambush claims,2024-08-05T01:48:49Z,https://www.bbc.com/news/articles/ceqdd7vdwg7o,"MALI, DIPLOMATIC, TIES, CLAIMS"
4,Robert F Kennedy Jr Says He Once Dumped Dead Bear In New York Central Park,2024-08-05T00:20:31Z,https://www.ndtv.com/world-news/robert-f-kennedy-jr-says-he-once-dumped-a-dead-bear-in-new-yorks-central-park-6264650,"ROBERT, DUMPED, DEAD, CENTRAL PARK"
